{"schema_version":1,"kind":"ORCHESTRATOR_METRICS_REPORT","generation_digest":"aaaaaaaaaaaaaaaaaaaaaaaaaaaaaaaaaaaaaaaaaaaaaaaaaaaaaaaaaaaaaaaa","registry_digest":"bbbbbbbbbbbbbbbbbbbbbbbbbbbbbbbbbbbbbbbbbbbbbbbbbbbbbbbbbbbbbbbb","evaluation_time":"2026-09-08T10:03:00Z","event_cutoff":"2026-09-08T10:03:00Z","knowledge_cutoff":"2026-09-08T10:03:00Z","registry_project_uuid":"22222222-2222-4222-8222-222222222222","policy_id":null,"cohort":{"package_id":null,"operation_id":null},"formula_catalog_version":1,"formula_catalog_digest":"cccccccccccccccccccccccccccccccccccccccccccccccccccccccccccccccc","access":"local","observation_count":0,"metrics":[]}
